{
  "bundle": {
    "manifestPath": "product-contract-bundle.json",
    "manifestSha256": "dd330d5b9e32e4bdbba04fdde7f4c63e5a0bde3ef559f0bea1c4761f43e148bf"
  },
  "contractApiVersion": "0.1.0",
  "formatVersion": 2,
  "owners": [
    {
      "catalogPath": "Cyrene-Catalyst/contracts/product/v2/catalog.json",
      "catalogSha256": "15977640d292e3dc0882f0dbdf1f97194a2599971999137f2f98316a5a309f9e",
      "ownerId": "catalyst",
      "repository": "Cyrene-Catalyst",
      "sourceSha": "912b915e04e8638e158cf38787aa137d7341e6ed"
    },
    {
      "catalogPath": "Cyrene-Echo/contracts/product/v2/catalog.json",
      "catalogSha256": "d6aeb91b4dea1ef7aaefe3ee43d57e53d1a0c03836b0101bea515e34fd728247",
      "ownerId": "echo",
      "repository": "Cyrene-Echo",
      "sourceSha": "a6923bf1e326069143b0b56d32b5891d36655e3f"
    },
    {
      "catalogPath": "Cyrene-Exchange/contracts/product/v2/catalog.json",
      "catalogSha256": "2e2b32c3c3b12d0c5804a7ee396d12276cb03bf5c2310f047f85b3eba61ccfe4",
      "ownerId": "exchange",
      "repository": "Cyrene-Exchange",
      "sourceSha": "ffe430f81b3b84dbf478770922e25fa20459ae28"
    },
    {
      "catalogPath": "Cyrene-Navigator/contracts/product/v2/catalog.json",
      "catalogSha256": "1471bd90fd0c36015103d5b3dcbd10f02e39103bde775b0a4b2f964ac0e8d6d0",
      "ownerId": "navigator",
      "repository": "Cyrene-Navigator",
      "sourceSha": "683b36451db0de55e8f01d707b391dd940128d15"
    },
    {
      "catalogPath": "Cyrene-Reactor/contracts/product/v2/catalog.json",
      "catalogSha256": "f00bb28e32b8ac000087a6525aaf2ca5db8cb2cc23c0833e39a24b9f0d597343",
      "ownerId": "reactor",
      "repository": "Cyrene-Reactor",
      "sourceSha": "82827dfe3f26d2d3a6a86360e330d009a275fdc5"
    },
    {
      "catalogPath": "Cyrene-Yield/contracts/product/v2/catalog.json",
      "catalogSha256": "7b70e373076f4760a95917bc9873679b84d1d3cc1d7ac35bdbcf086fcf7d690a",
      "ownerId": "yield",
      "repository": "Cyrene-Yield",
      "sourceSha": "46a41de2bb7d33f6a7c45187a2c33b2f7700d019"
    }
  ],
  "policy": {
    "bundlePath": "workspace-product-policy-v2.json",
    "schemaVersion": "cyrene.workspace.product.authorization-policy.v2",
    "sha256": "6b739471db01eb6d153c9132251d24921c88807832ec4afca2235a2bf4016865",
    "sourcePath": "contracts/policies/workspace-product-policy-v2.json"
  },
  "releaseId": "workspace-product-v2-initial",
  "wireApiVersion": "cyrene.workspace.product.v2"
}
